{
  "schema_version": "focus_state.v1",
  "focus_state_id": "fcs_001",
  "user_id": "usr_001",
  "device_id": "dev_001",
  "state": "focus",
  "confidence": 1.0,
  "signals": {
    "manual_mode": "focus"
  },
  "interruption_policy": {
    "allow_noncritical_interruptions": false,
    "allow_critical_interruptions": true,
    "allow_daily_review_prompt": false,
    "allow_quick_capture_confirmation": true,
    "batch_until": "2026-06-22T12:00:00Z"
  },
  "allowed_notification_types": [
    "critical_deadline",
    "user_requested_alarm"
  ],
  "suppressed_notification_types": [
    "suggested_followup",
    "daily_review",
    "low_priority_task",
    "memory_insight"
  ],
  "created_at": "2026-06-22T10:30:00Z",
  "expires_at": "2026-06-22T12:00:00Z"
}